{
  "domain_dimensions": [
    60,
    30
  ],
  "volume_fraction": 0.45,
  "units": {
    "length": "mm",
    "force": "N",
    "temperature": "K"
  },
  "dof_ordering": "node_major",
  "material": {
    "youngs_modulus": 1.0,
    "poisson_ratio": 0.3,
    "thermal_expansion": 0.02,
    "conductivity": 1.0,
    "density_floor": 0.001,
    "penalization": {
      "stiffness": 3,
      "conductivity": 3
    },
    "filter_radius": 2.4
  },
  "reference_temperature": 0.0,
  "objective": {
    "mode": "thermoelastic_compliance"
  },
  "coupling": {
    "mode": "one_way"
  },
  "supports": [
    {
      "node_indices": [
        0,
        61,
        122,
        183,
        244,
        305,
        366,
        427,
        488,
        549,
        610,
        671,
        732,
        793,
        854,
        915,
        976,
        1037,
        1098,
        1159,
        1220,
        1281,
        1342,
        1403,
        1464,
        1525,
        1586,
        1647,
        1708,
        1769,
        1830
      ],
      "fixed_components": [
        0,
        1
      ]
    }
  ],
  "loads": [
    {
      "node_indices": [
        975
      ],
      "force_vector": [
        0.0,
        -3.0
      ]
    }
  ],
  "thermal_supports": [
    {
      "node_indices": [
        0,
        61,
        122,
        183,
        244,
        305,
        366,
        427,
        488,
        549,
        610,
        671,
        732,
        793,
        854,
        915,
        976,
        1037,
        1098,
        1159,
        1220,
        1281,
        1342,
        1403,
        1464,
        1525,
        1586,
        1647,
        1708,
        1769,
        1830
      ],
      "temperature": 0.0
    }
  ],
  "thermal_loads": [
    {
      "node_indices": [
        30,
        91,
        152,
        213,
        274,
        335,
        396,
        457,
        518,
        579,
        640,
        701,
        762,
        823,
        884,
        945,
        1006,
        1067,
        1128,
        1189,
        1250,
        1311,
        1372,
        1433,
        1494,
        1555,
        1616,
        1677,
        1738,
        1799,
        1860,
        31,
        92,
        153,
        214,
        275,
        336,
        397,
        458,
        519,
        580,
        641,
        702,
        763,
        824,
        885,
        946,
        1007,
        1068,
        1129,
        1190,
        1251,
        1312,
        1373,
        1434,
        1495,
        1556,
        1617,
        1678,
        1739,
        1800,
        1861,
        32,
        93,
        154,
        215,
        276,
        337,
        398,
        459,
        520,
        581,
        642,
        703,
        764,
        825,
        886,
        947,
        1008,
        1069,
        1130,
        1191,
        1252,
        1313,
        1374,
        1435,
        1496,
        1557,
        1618,
        1679,
        1740,
        1801,
        1862,
        33,
        94,
        155,
        216,
        277,
        338,
        399,
        460,
        521,
        582,
        643,
        704,
        765,
        826,
        887,
        948,
        1009,
        1070,
        1131,
        1192,
        1253,
        1314,
        1375,
        1436,
        1497,
        1558,
        1619,
        1680,
        1741,
        1802,
        1863,
        34,
        95,
        156,
        217,
        278,
        339,
        400,
        461,
        522,
        583,
        644,
        705,
        766,
        827,
        888,
        949,
        1010,
        1071,
        1132,
        1193,
        1254,
        1315,
        1376,
        1437,
        1498,
        1559,
        1620,
        1681,
        1742,
        1803,
        1864,
        35,
        96,
        157,
        218,
        279,
        340,
        401,
        462,
        523,
        584,
        645,
        706,
        767,
        828,
        889,
        950,
        1011,
        1072,
        1133,
        1194,
        1255,
        1316,
        1377,
        1438,
        1499,
        1560,
        1621,
        1682,
        1743,
        1804,
        1865,
        36,
        97,
        158,
        219,
        280,
        341,
        402,
        463,
        524,
        585,
        646,
        707,
        768,
        829,
        890,
        951,
        1012,
        1073,
        1134,
        1195,
        1256,
        1317,
        1378,
        1439,
        1500,
        1561,
        1622,
        1683,
        1744,
        1805,
        1866,
        37,
        98,
        159,
        220,
        281,
        342,
        403,
        464,
        525,
        586,
        647,
        708,
        769,
        830,
        891,
        952,
        1013,
        1074,
        1135,
        1196,
        1257,
        1318,
        1379,
        1440,
        1501,
        1562,
        1623,
        1684,
        1745,
        1806,
        1867,
        38,
        99,
        160,
        221,
        282,
        343,
        404,
        465,
        526,
        587,
        648,
        709,
        770,
        831,
        892,
        953,
        1014,
        1075,
        1136,
        1197,
        1258,
        1319,
        1380,
        1441,
        1502,
        1563,
        1624,
        1685,
        1746,
        1807,
        1868,
        39,
        100,
        161,
        222,
        283,
        344,
        405,
        466,
        527,
        588,
        649,
        710,
        771,
        832,
        893,
        954,
        1015,
        1076,
        1137,
        1198,
        1259,
        1320,
        1381,
        1442,
        1503,
        1564,
        1625,
        1686,
        1747,
        1808,
        1869,
        40,
        101,
        162,
        223,
        284,
        345,
        406,
        467,
        528,
        589,
        650,
        711,
        772,
        833,
        894,
        955,
        1016,
        1077,
        1138,
        1199,
        1260,
        1321,
        1382,
        1443,
        1504,
        1565,
        1626,
        1687,
        1748,
        1809,
        1870,
        41,
        102,
        163,
        224,
        285,
        346,
        407,
        468,
        529,
        590,
        651,
        712,
        773,
        834,
        895,
        956,
        1017,
        1078,
        1139,
        1200,
        1261,
        1322,
        1383,
        1444,
        1505,
        1566,
        1627,
        1688,
        1749,
        1810,
        1871,
        42,
        103,
        164,
        225,
        286,
        347,
        408,
        469,
        530,
        591,
        652,
        713,
        774,
        835,
        896,
        957,
        1018,
        1079,
        1140,
        1201,
        1262,
        1323,
        1384,
        1445,
        1506,
        1567,
        1628,
        1689,
        1750,
        1811,
        1872,
        43,
        104,
        165,
        226,
        287,
        348,
        409,
        470,
        531,
        592,
        653,
        714,
        775,
        836,
        897,
        958,
        1019,
        1080,
        1141,
        1202,
        1263,
        1324,
        1385,
        1446,
        1507,
        1568,
        1629,
        1690,
        1751,
        1812,
        1873,
        44,
        105,
        166,
        227,
        288,
        349,
        410,
        471,
        532,
        593,
        654,
        715,
        776,
        837,
        898,
        959,
        1020,
        1081,
        1142,
        1203,
        1264,
        1325,
        1386,
        1447,
        1508,
        1569,
        1630,
        1691,
        1752,
        1813,
        1874,
        45,
        106,
        167,
        228,
        289,
        350,
        411,
        472,
        533,
        594,
        655,
        716,
        777,
        838,
        899,
        960,
        1021,
        1082,
        1143,
        1204,
        1265,
        1326,
        1387,
        1448,
        1509,
        1570,
        1631,
        1692,
        1753,
        1814,
        1875,
        46,
        107,
        168,
        229,
        290,
        351,
        412,
        473,
        534,
        595,
        656,
        717,
        778,
        839,
        900,
        961,
        1022,
        1083,
        1144,
        1205,
        1266,
        1327,
        1388,
        1449,
        1510,
        1571,
        1632,
        1693,
        1754,
        1815,
        1876,
        47,
        108,
        169,
        230,
        291,
        352,
        413,
        474,
        535,
        596,
        657,
        718,
        779,
        840,
        901,
        962,
        1023,
        1084,
        1145,
        1206,
        1267,
        1328,
        1389,
        1450,
        1511,
        1572,
        1633,
        1694,
        1755,
        1816,
        1877,
        48,
        109,
        170,
        231,
        292,
        353,
        414,
        475,
        536,
        597,
        658,
        719,
        780,
        841,
        902,
        963,
        1024,
        1085,
        1146,
        1207,
        1268,
        1329,
        1390,
        1451,
        1512,
        1573,
        1634,
        1695,
        1756,
        1817,
        1878,
        49,
        110,
        171,
        232,
        293,
        354,
        415,
        476,
        537,
        598,
        659,
        720,
        781,
        842,
        903,
        964,
        1025,
        1086,
        1147,
        1208,